id,name,employer,city,salary_from,salary_to,currency,experience,employment,schedule,published_at,url,requirement,description
131758015,Аналитик данных,"ТрансМашХолдинг, Группа компаний",Москва,,,,От 3 до 6 лет,Не указана,Не указан,2026-04-16T19:05:16+0300,https://hh.ru/vacancy/131758015,,"Мы - уже 22 года динамично развиваемся и обеспечиваем холдинг товарно-материальными ценностями, сырьем и оборудованием. Наша миссия - оперативно снабжать заводы всем необходимым для бесперебойной работы и производства подвижных составов, локомотивов для этого мы ищем кандидата на вакансию аналитика цен в офисе . В договоре должность - главный специалист. ЧЕМ ПРЕДСТОИТ ЗАНИМАТЬСЯ: Анализ калькуляций себестоимости закупаемой продукции в части материальных затрат, ФОТ, накладных расходов. Факторный анализ причин изменения себестоимости. Настройка и подготовка отчетности, справочных материалов, аналитических записок, презентаций, динамик по показателям с анализом трендов и критических отклонений по вопросам ценообразования. Мониторинг показателей по процессам, построение визуализации и отчетности в Excel, Power BI. Участие в проектах по автоматизации и цифровизации финансово-экономической деятельности. Подготовка технических заданий для формирования отчетности в 1С. Анализ бизнес-процессов, подготовка предложений по их оптимизации. НАМ ВАЖНО НАЛИЧИЕ: Высшего образования (экономическое/ инженерно-экономическое) Опыт работы в области финансового анализа или смежной деятельности от 3 лет Опыт конфигурирования и формирования отчетных данных в 1С (ERP)​​​​​​​ Уверенное владение Excel (формулы, сводные таблицы, макросы) Опыта анализа данных и подготовки аналитических отчетов (Excel и тд) Навыка работы с ERP-системами (желательно 1С ERP) Уверенное владение PowerPoint Опыт работы в Power BI по визуализации данных и интерактивных отчетов Владение справочно-правовыми системами Консультант Плюс, Гарант Огромный плюс: знания по основам проектного управления, участие в проектах по автоматизации. Личных качеств: аналитический склад ума, умений четко и ясно отражать результаты анализа устно и письменно, внимание к деталям. МЫ ПРЕДЛАГАЕМ: ✅ Стабильность: - Конкурентная «белая» зарплата + регулярные квартальные премии (40-60% от оклада). - Соц. пакет: ДМС после испытательного срок, материальная помощь по определенным случаям. ✅ Поддержка семьи: - Дополнительные оплачиваемые дни отпуска: 1 сентября (для родителей первоклашек), рождение ребенка (для отцов), свадьба. - График 5/2 (с 9:00 до 18:00) в офисе , рядом с м. Белорусская (~ 10 минут пешком) ✅ Развитие и комфорт: - Обучение за счет компании (курсы, электронная библиотека для всей семьи, вебинары). - Участие в обработке данных компании и в проектах - профессиональный рост гарантирован! - Дружный коллектив и спортивные мероприятия, где рады видеть вас и ваших близких. Мы создаем среду, где можно совмещать карьеру и развитие. Если вы ответственный специалист, готовый расти вместе с нами, - ждем ваше резюме!"
132235835,Аналитик данных 1С,МКК Русзаймсервис,Москва,,,,,,,2026-04-17T12:47:38+0300,https://hh.ru/vacancy/132235835,"Опыт работы аналитиком / BI-аналитиком от 1 года. Уверенные навыки работы с 1С: Понимание структуры данных (регистры, документы, справочники). ","Формирование оперативной отчетности по направлению взыскания на основе данных из 1С. Извлечение, обработка и анализ данных из 1С..."
130635779,Младший бизнес-аналитик,Gridnine,Москва,,,,,,,2026-04-18T11:12:06+0300,https://hh.ru/vacancy/130635779,Понимание бизнес-процессов и опыт их моделирования. Навыки сбора и анализа данных. Умение формировать требования и технические задания. ,"Сбор и анализ данных о бизнес-процессах компании. Конфигурирование и настройка бизнес-процессов, отладка и внесение изменений. Описание и документирование..."
132237553,"Аналитик данных (веб-аналитика, DWH, BI)",Парк Сказка,Москва,,,,,,,2026-04-17T13:23:19+0300,https://hh.ru/vacancy/132237553,"DWH & ETL: понимание архитектуры хранения, опыт построения слоёв данных, работы с витринами, принципов качества данных. Веб- и маркетинговая аналитика: глубокое...","Обеспечивать качество данных: мониторинг аномалий, валидация, устранение расхождений, ведение глоссария метрик. Выстраивать сквозную аналитику от первого касания до повторной покупки. "
132208282,Аналитик данных,Технопром,Москва,,,,,,,2026-04-16T15:19:15+0300,https://hh.ru/vacancy/132208282,"Высшее профильное образование (базовые знания математической статистики). Опыт в роли дата-аналитика в финансовых, продуктовых или кросс-функциональных командах от...","Подготовка и согласование технических заданий, определение источников данных и форматов отчетности. Подключение к различным источникам данных (базы данных, Excel, CSV..."
131859176,Бизнес-аналитик (Уганда),INTEGRA CITY - fzco,Москва,,,,,,,2026-04-18T10:40:13+0300,https://hh.ru/vacancy/131859176,Опыт работы бизнес-аналитиком от 3-х лет. Знание SDLC и рамочных моделей ИТ-систем. Владение JIRA. Аналитический склад ума. ,Сбор требований: сотрудничество с международной командой ITMS и местной командой разработки продуктов для документирования и анализа бизнес-требований. 
131531921,Руководитель группы аналитики,Лайв Саунд,Москва,,,,,,,2026-04-18T10:31:53+0300,https://hh.ru/vacancy/131531921,Наличие логических способностей в части алгоритмизации расчетов. Требования: ​​​​​​​— Опыт работы аналитиком не менее 5-ти лет. — Высшее образование (ИТ / экономика...,"Выполнение иных поручений непосредственного руководителя, связанных с профессиональной деятельностью по занимаемой. — Организация работы группы аналитиков, управление ресурсами команды и сроками..."
132246165,Аналитик,Глав Денталь,Москва,,90000,RUR,,,,2026-04-17T16:06:37+0300,https://hh.ru/vacancy/132246165,Языки программирования: знание Python или R для статистической обработки данных и автоматизации расчетов. Аналитическая база: высшее образование в области математики...,SQL: основной язык для работы с базами данных. Телефонное интервью с HR. Онлайн встреча. Тестовое задание. Личная встреча в офисе.
132130019,Аналитик,ВТБ Специализированный депозитарий,Москва,,,,,,,2026-04-17T15:39:40+0300,https://hh.ru/vacancy/132130019,"магистратура/специалитет). Опыт от 5 лет в роли бизнес-/системного аналитика в финсекторе. Знание предметной области: учет активов, контроль операций...","Проектирование процессов, данных, архитектуры решений: AS-IS / TO-BE, спецификации интеграций, маппинг данных. Подготовка ТЗ, пользовательских сценариев, критериев приемки (UAT). "
